{
    "$schema": "http://json-schema.org/draft-07/schema#",
    "type": "object",
    "properties": {
        "id": {
            "type": "integer"
        },
        "name": {
            "type": "string"
        },
        "age": {
            "type": "integer",
            "minimum": 18
        },
        "email": {
            "type": "string",
            "format": "email"
        }
    },
    "required": [
        "id",
        "name",
        "email"
    ]
}