[
    {
        "id": 1,
        "name": "Alice",
        "age": 25,
        "email": "alice@example.com"
    },
    {
        "id": 2,
        "name": "Bob",
        "age": 30,
        "email": "bob@example.com"
    },
    {
        "id": 3,
        "name": "Charlie",
        "age": 22,
        "email": "charlie@example.com"
    }
]